{
  "id": "evt_user_message_001",
  "timestamp": "2026-06-05T20:00:00.000Z",
  "workspace_id": "ws_demo",
  "run_id": "run_demo",
  "event_type": "user.message",
  "actor": {
    "type": "user",
    "id": "user_local"
  },
  "summary": "User asked Aetherion to read a local project file.",
  "hash_version": "aetherion-event-v1",
  "sensitivity": "private",
  "taint": {
    "sources": ["user"],
    "can_authorize_actions": true
  },
  "retention": {
    "ttl": "365d",
    "user_deletable": true
  }
}
